{
  "$schema": "https://json-schema.org/draft/2020-12/schema",
  "$id": "https://get.owncloud.com/schema/deployment.schema.json",
  "title": "ownCloud Infinite Scale deployment profile",
  "type": "object",
  "additionalProperties": false,
  "required": ["apiVersion", "purpose", "target", "workload", "identity", "storage", "office", "networking"],
  "properties": {
    "apiVersion": { "const": "get.owncloud.com/v1alpha1" },
    "purpose": { "enum": ["evaluation", "production"] },
    "maturity": { "enum": ["community-preview", "production"] },
    "ocisVersion": { "enum": ["8.2.0", "7.1.4"] },
    "target": {
      "type": "object",
      "additionalProperties": false,
      "required": ["runtime", "manager"],
      "properties": {
        "runtime": { "enum": ["docker", "podman", "kubernetes"] },
        "manager": { "enum": ["direct", "ansible", "argocd"] }
      }
    },
    "workload": { "$ref": "sizing-input.schema.json" },
    "identity": {
      "type": "object",
      "additionalProperties": false,
      "required": ["mode"],
      "properties": {
        "mode": { "enum": ["embedded", "external-oidc", "keycloak"] },
        "issuer": { "type": "string", "format": "uri", "pattern": "^https://" },
        "clientId": { "type": "string", "minLength": 1 },
        "userClaim": { "type": "string", "default": "preferred_username" },
        "cs3Claim": { "type": "string", "default": "username" },
        "ldapUri": { "type": "string", "pattern": "^ldaps://" },
        "ldapBindDn": { "type": "string", "minLength": 1 },
        "ldapSecretRef": { "type": "string", "minLength": 1 },
        "ldapUserBaseDn": { "type": "string", "minLength": 1 },
        "ldapGroupBaseDn": { "type": "string", "minLength": 1 },
        "ldapUserIdAttribute": { "type": "string", "default": "ownclouduuid" },
        "ldapUserNameAttribute": { "type": "string", "default": "uid" },
        "ldapGroupIdAttribute": { "type": "string", "default": "ownclouduuid" },
        "ldapGroupNameAttribute": { "type": "string", "default": "cn" },
        "keycloakAdminPasswordSecretRef": { "type": "string", "minLength": 1 },
        "keycloakDatabasePasswordSecretRef": { "type": "string", "minLength": 1 }
      }
    },
    "storage": {
      "type": "object",
      "additionalProperties": false,
      "required": ["mode", "filesystem", "dataPath"],
      "properties": {
        "mode": { "enum": ["ocis", "s3ng"] },
        "filesystem": { "enum": ["ext4", "xfs", "btrfs", "zfs", "nfs"] },
        "dataPath": { "type": "string", "minLength": 1 },
        "configPath": { "type": "string", "minLength": 1 },
        "nfsVersion": { "const": "4.2" },
        "storageClassName": { "type": "string", "minLength": 1 },
        "s3": {
          "type": "object",
          "additionalProperties": false,
          "required": ["endpoint", "region", "bucket", "accessKeyReference", "secretKeyReference"],
          "properties": {
            "endpoint": { "type": "string", "format": "uri", "pattern": "^https://" },
            "region": { "type": "string", "minLength": 1 },
            "bucket": { "type": "string", "minLength": 1 },
            "accessKeyReference": { "type": "string", "minLength": 1 },
            "secretKeyReference": { "type": "string", "minLength": 1 }
          }
        }
      }
    },
    "office": {
      "type": "object",
      "additionalProperties": false,
      "required": ["mode"],
      "properties": {
        "mode": { "enum": ["none", "collabora"] },
        "deployment": { "enum": ["bundled", "external"] },
        "url": { "type": "string", "format": "uri", "pattern": "^https://" }
      }
    },
    "networking": {
      "type": "object",
      "additionalProperties": false,
      "required": ["domain", "tls"],
      "properties": {
        "domain": { "type": "string", "minLength": 1 },
        "collaboraDomain": { "type": "string", "minLength": 1 },
        "httpPort": { "type": "integer", "minimum": 1, "maximum": 65535 },
        "httpsPort": { "type": "integer", "minimum": 1, "maximum": 65535 },
        "ingressClassName": { "type": "string", "minLength": 1 },
        "tlsSecretName": { "type": "string", "minLength": 1 },
        "tls": {
          "type": "object",
          "additionalProperties": false,
          "required": ["mode"],
          "properties": {
            "mode": { "enum": ["acme", "evaluation-self-signed"] },
            "email": { "type": "string", "format": "email" },
            "caServer": { "type": "string", "format": "uri" }
          }
        }
      }
    },
    "mail": {
      "type": "object",
      "additionalProperties": false,
      "properties": {
        "host": { "type": "string", "minLength": 1 },
        "port": { "type": "integer", "minimum": 1, "maximum": 65535 },
        "sender": { "type": "string", "minLength": 1 },
        "senderDisplayName": { "type": "string" },
        "username": { "type": "string" },
        "authentication": { "enum": ["none", "plain", "login", "cram-md5", "auto"] },
        "passwordSecretRef": { "type": "string" },
        "transportSecurity": { "enum": ["tls", "starttls", "insecure"] },
        "caTrust": { "enum": ["system", "custom"] },
        "caSecretRef": { "type": "string" },
        "insecure": { "type": "boolean" }
      }
    },
    "features": {
      "type": "object",
      "additionalProperties": false,
      "properties": {
        "clamav": {
          "oneOf": [
            { "type": "boolean" },
            { 
              "type": "object",
              "additionalProperties": false,
              "properties": {
                "enabled": { "type": "boolean" },
                "imageDigest": { "type": "string", "pattern": "^sha256:[a-f0-9]{64}$" },
                "storageClassName": { "type": "string" },
                "sizeGiB": { "type": "integer", "minimum": 1 },
                "cpu": { "type": "number", "minimum": 0.1 },
                "memoryMiB": { "type": "integer", "minimum": 1024 }
              }
            }
          ]
        },
        "search": { "type": "boolean" },
        "notifications": { "type": "boolean" },
        "monitoring": {
          "oneOf": [
            { "type": "boolean" },
            { 
              "type": "object",
              "additionalProperties": false,
              "properties": {
                "enabled": { "type": "boolean" },
                "metrics": {
                  "type": "object",
                  "additionalProperties": false,
                  "properties": {
                    "enabled": { "type": "boolean" },
                    "endpoint": { "type": "string", "format": "uri" },
                    "authentication": { "type": "boolean" }
                  }
                },
                "opentelemetry": {
                  "type": "object",
                  "additionalProperties": false,
                  "properties": {
                    "enabled": { "type": "boolean" },
                    "endpoint": { "type": "string", "format": "uri" },
                    "protocol": { "enum": ["grpc", "http"] },
                    "tls": { "type": "boolean" },
                    "caSecretRef": { "type": "string" }
                  }
                }
              }
            }
          ]
        }
      }
    },
    "security": {
      "type": "object",
      "additionalProperties": false,
      "properties": {
        "basicAuth": { "type": "boolean" },
        "demoUsers": { "type": "boolean" }
      }
    },
    "updates": {
      "type": "object",
      "additionalProperties": false,
      "properties": {
        "automaticSecurityPatches": { "type": "boolean" },
        "observationDelayHours": { "type": "integer", "minimum": 24 },
        "backupRecipient": {
          "type": "string",
          "pattern": "^(age1|ssh-ed25519 )",
          "description": "Operator-controlled public recipient used to encrypt automatic pre-update backups"
        }
      }
    },
    "system": {
      "type": "object",
      "additionalProperties": false,
      "required": ["cpu", "ramMiB", "diskGiB"],
      "properties": {
        "cpu": { "type": "integer", "minimum": 1 },
        "ramMiB": { "type": "integer", "minimum": 1 },
        "diskGiB": { "type": "number", "minimum": 0 }
      }
    }
  }
}
