{
  "apiVersion": "get.owncloud.com/v1alpha1",
  "purpose": "evaluation",
  "maturity": "community-preview",
  "ocisVersion": "7.1.4",
  "target": { "runtime": "kubernetes", "manager": "argocd" },
  "workload": { "registeredUsers": 100, "storedDataGiB": 500 },
  "identity": {
    "mode": "external-oidc",
    "issuer": "https://id.example.net/realms/owncloud",
    "clientId": "web",
    "ldapUri": "ldaps://directory.example.net:636",
    "ldapBindDn": "uid=ocis,ou=system,dc=example,dc=net",
    "ldapSecretRef": "owncloud-external-ldap",
    "ldapUserBaseDn": "ou=users,dc=example,dc=net",
    "ldapGroupBaseDn": "ou=groups,dc=example,dc=net"
  },
  "storage": {
    "mode": "ocis",
    "filesystem": "nfs",
    "nfsVersion": "4.2",
    "storageClassName": "nfs-4-2",
    "dataPath": "./data",
    "configPath": "./config"
  },
  "office": { "mode": "collabora", "deployment": "external", "url": "https://office.example.net" },
  "networking": {
    "domain": "cloud.example.net",
    "ingressClassName": "nginx",
    "tlsSecretName": "owncloud-tls",
    "tls": { "mode": "acme", "email": "hostmaster@example.net" }
  },
  "features": { "search": true, "clamav": false, "notifications": false, "monitoring": false }
}
